,api_uri,chair,chair_id,chair_party,chair_state,chair_uri,chamber,id,name,ranking_member_id,subcommittees,url
0,https://api.propublica.org/congress/v1/111/senate/committees/SSAF.json,Blanche Lincoln,L000035,D,AR,https://api.propublica.org/congress/v1/members/L000035.json,Senate,SSAF,"Committee on Agriculture, Nutrition, and Forestry",C000286,"[{'id': 'SSAF13', 'name': 'Subcommittee on Commodities, Markets, Trade and Risk Management', 'api_uri': 'https://api.propublica.org/congress/v1/111/senate/committees/SSAF/subcommittees/SSAF13.json'}, {'id': 'SSAF14', 'name': 'Conservation, Forestry and Natural Resources Subcommittee', 'api_uri': 'https://api.propublica.org/congress/v1/111/senate/committees/SSAF/subcommittees/SSAF14.json'}, {'id': 'SSAF15', 'name': 'Jobs, Rural Economic Growth and Energy Innovation Subcommittee', 'api_uri': 'https://api.propublica.org/congress/v1/111/senate/committees/SSAF/subcommittees/SSAF15.json'}, {'id': 'SSAF17', 'name': 'Subcommittee on Livestock, Dairy, Poultry, Marketing and Agriculture Security', 'api_uri': 'https://api.propublica.org/congress/v1/111/senate/committees/SSAF/subcommittees/SSAF17.json'}, {'id': 'SSAF16', 'name': 'Subcommittee on Nutrition, Specialty Crops, Food and Agricultural Research', 'api_uri': 'https://api.propublica.org/congress/v1/111/senate/committees/SSAF/subcommittees/SSAF16.json'}]",https://www.agriculture.senate.gov/
1,https://api.propublica.org/congress/v1/111/senate/committees/SSAP.json,Daniel K. Inouye,I000025,D,HI,https://api.propublica.org/congress/v1/members/I000025.json,Senate,SSAP,Committee on Appropriations,C000567,"[{'id': 'SSAP18', 'name': 'Departments of Labor, Health and Human Services, and Education, and Related Agencies', 'api_uri': 'https://api.propublica.org/congress/v1/111/senate/committees/SSAP/subcommittees/SSAP18.json'}, {'id': 'SSAP16', 'name': 'Commerce, Justice, Science, and Related Agencies Subcommittee', 'api_uri': 'https://api.propublica.org/congress/v1/111/senate/committees/SSAP/subcommittees/SSAP16.json'}, {'id': 'SSAP22', 'name': 'Energy and Water Development Subcommittee', 'api_uri': 'https://api.propublica.org/congress/v1/111/senate/committees/SSAP/subcommittees/SSAP22.json'}, {'id': 'SSAP20', 'name': 'State, Foreign Operations, and Related Programs Subcommittee', 'api_uri': 'https://api.propublica.org/congress/v1/111/senate/committees/SSAP/subcommittees/SSAP20.json'}, {'id': 'SSAP14', 'name': 'Department of Homeland Security Subcommittee', 'api_uri': 'https://api.propublica.org/congress/v1/111/senate/committees/SSAP/subcommittees/SSAP14.json'}, {'id': 'SSAP17', 'name': 'Department of the Interior, Environment, and Related Agencies', 'api_uri': 'https://api.propublica.org/congress/v1/111/senate/committees/SSAP/subcommittees/SSAP17.json'}, {'id': 'SSAP24', 'name': 'Transportation, Housing and Urban Development, and Related Agencies', 'api_uri': 'https://api.propublica.org/congress/v1/111/senate/committees/SSAP/subcommittees/SSAP24.json'}, {'id': 'SSAP08', 'name': 'Legislative Branch Subcommittee', 'api_uri': 'https://api.propublica.org/congress/v1/111/senate/committees/SSAP/subcommittees/SSAP08.json'}, {'id': 'SSAP01', 'name': 'Agriculture, Rural Development, Food and Drug Administration, and Related Agencies', 'api_uri': 'https://api.propublica.org/congress/v1/111/senate/committees/SSAP/subcommittees/SSAP01.json'}, {'id': 'SSAP02', 'name': 'Department of Defense Subcommittee', 'api_uri': 'https://api.propublica.org/congress/v1/111/senate/committees/SSAP/subcommittees/SSAP02.json'}, {'id': 'SSAP19', 'name': 'Military Construction and Veterans Affairs, and Related Agencies', 'api_uri': 'https://api.propublica.org/congress/v1/111/senate/committees/SSAP/subcommittees/SSAP19.json'}, {'id': 'SSAP23', 'name': 'Financial Services and General Government Subcommittee', 'api_uri': 'https://api.propublica.org/congress/v1/111/senate/committees/SSAP/subcommittees/SSAP23.json'}]",https://www.appropriations.senate.gov/
2,https://api.propublica.org/congress/v1/111/senate/committees/SSAS.json,Carl Levin,L000261,D,MI,https://api.propublica.org/congress/v1/members/L000261.json,Senate,SSAS,Committee on Armed Services,M000303,"[{'id': 'SSAS16', 'name': 'Strategic Forces Subcommittee', 'api_uri': 'https://api.propublica.org/congress/v1/111/senate/committees/SSAS/subcommittees/SSAS16.json'}, {'id': 'SSAS20', 'name': 'Emerging Threats and Capabilities Subcommittee', 'api_uri': 'https://api.propublica.org/congress/v1/111/senate/committees/SSAS/subcommittees/SSAS20.json'}, {'id': 'SSAS17', 'name': 'Personnel Subcommittee', 'api_uri': 'https://api.propublica.org/congress/v1/111/senate/committees/SSAS/subcommittees/SSAS17.json'}, {'id': 'SSAS13', 'name': 'SeaPower Subcommittee', 'api_uri': 'https://api.propublica.org/congress/v1/111/senate/committees/SSAS/subcommittees/SSAS13.json'}, {'id': 'SSAS14', 'name': 'Airland Subcommittee', 'api_uri': 'https://api.propublica.org/congress/v1/111/senate/committees/SSAS/subcommittees/SSAS14.json'}, {'id': 'SSAS15', 'name': 'Readiness and Management Support Subcommittee', 'api_uri': 'https://api.propublica.org/congress/v1/111/senate/committees/SSAS/subcommittees/SSAS15.json'}, {'id': 'SSAS21', 'name': 'Cybersecurity Subcommittee', 'api_uri': 'https://api.propublica.org/congress/v1/111/senate/committees/SSAS/subcommittees/SSAS21.json'}]",https://www.armed-services.senate.gov/
3,https://api.propublica.org/congress/v1/111/senate/committees/SSBK.json,Christopher J. Dodd,D000388,D,CT,https://api.propublica.org/congress/v1/members/D000388.json,Senate,SSBK,"Committee on Banking, Housing, and Urban Affairs",S000320,"[{'id': 'SSBK04', 'name': 'Securities, Insurance, and Investment Subcommittee', 'api_uri': 'https://api.propublica.org/congress/v1/111/senate/committees/SSBK/subcommittees/SSBK04.json'}, {'id': 'SSBK09', 'name': 'Housing, Transportation, and Community Development', 'api_uri': 'https://api.propublica.org/congress/v1/111/senate/committees/SSBK/subcommittees/SSBK09.json'}, {'id': 'SSBK12', 'name': 'Economic Policy Subcommittee', 'api_uri': 'https://api.propublica.org/congress/v1/111/senate/committees/SSBK/subcommittees/SSBK12.json'}, {'id': 'SSBK05', 'name': 'National Security and  International Trade and Finance', 'api_uri': 'https://api.propublica.org/congress/v1/111/senate/committees/SSBK/subcommittees/SSBK05.json'}, {'id': 'SSBK08', 'name': 'Financial Institutions and Consumer Protection Subcommittee', 'api_uri': 'https://api.propublica.org/congress/v1/111/senate/committees/SSBK/subcommittees/SSBK08.json'}]",https://www.banking.senate.gov/public/
4,https://api.propublica.org/congress/v1/111/senate/committees/SSCM.json,John D. Rockefeller IV,R000361,D,WV,https://api.propublica.org/congress/v1/members/R000361.json,Senate,SSCM,"Committee on Commerce, Science, and Transportation",H001016,"[{'id': 'SSCM24', 'name': 'Space, Science, and Competitiveness Subcommittee', 'api_uri': 'https://api.propublica.org/congress/v1/111/senate/committees/SSCM/subcommittees/SSCM24.json'}, {'id': 'SSCM01', 'name': 'Aviation Operations, Safety, and Security Subcommittee', 'api_uri': 'https://api.propublica.org/congress/v1/111/senate/committees/SSCM/subcommittees/SSCM01.json'}, {'id': 'SSCM22', 'name': 'Oceans, Atmosphere, Fisheries, and Coast Guard Subcommittee', 'api_uri': 'https://api.propublica.org/congress/v1/111/senate/committees/SSCM/subcommittees/SSCM22.json'}, {'id': 'SSCM20', 'name': 'Consumer Protection, Product Safety, Insurance, and Data Security', 'api_uri': 'https://api.propublica.org/congress/v1/111/senate/committees/SSCM/subcommittees/SSCM20.json'}, {'id': 'SSCM26', 'name': 'Communications, Technology, Innovation, and the Internet', 'api_uri': 'https://api.propublica.org/congress/v1/111/senate/committees/SSCM/subcommittees/SSCM26.json'}, {'id': 'SSCM25', 'name': 'Surface Transportation and Merchant Marine Infrastructure, Safety and Security', 'api_uri': 'https://api.propublica.org/congress/v1/111/senate/committees/SSCM/subcommittees/SSCM25.json'}]",https://www.commerce.senate.gov/public/
5,https://api.propublica.org/congress/v1/111/senate/committees/SSEG.json,Jeff Bingaman,B000468,D,NM,https://api.propublica.org/congress/v1/members/B000468.json,Senate,SSEG,Committee on Energy and Natural Resources,M001153,"[{'id': 'SSEG03', 'name': 'Public Lands, Forests, and Mining Subcommittee', 'api_uri': 'https://api.propublica.org/congress/v1/111/senate/committees/SSEG/subcommittees/SSEG03.json'}, {'id': 'SSEG04', 'name': 'National Parks Subcommittee', 'api_uri': 'https://api.propublica.org/congress/v1/111/senate/committees/SSEG/subcommittees/SSEG04.json'}, {'id': 'SSEG07', 'name': 'Water and Power Subcommittee', 'api_uri': 'https://api.propublica.org/congress/v1/111/senate/committees/SSEG/subcommittees/SSEG07.json'}, {'id': 'SSEG01', 'name': 'Energy Subcommittee', 'api_uri': 'https://api.propublica.org/congress/v1/111/senate/committees/SSEG/subcommittees/SSEG01.json'}]",https://www.energy.senate.gov/public/
6,https://api.propublica.org/congress/v1/111/senate/committees/SSEV.json,Barbara Boxer,B000711,D,CA,https://api.propublica.org/congress/v1/members/B000711.json,Senate,SSEV,Committee on Environment and Public Works,I000024,"[{'id': 'SSEV15', 'name': 'Fisheries, Water, and Wildlife Subcommittee', 'api_uri': 'https://api.propublica.org/congress/v1/111/senate/committees/SSEV/subcommittees/SSEV15.json'}, {'id': 'SSEV09', 'name': 'Superfund, Waste Management, and Regulatory Oversight', 'api_uri': 'https://api.propublica.org/congress/v1/111/senate/committees/SSEV/subcommittees/SSEV09.json'}, {'id': 'SSEV10', 'name': 'Clean Air and Nuclear Safety Subcommittee', 'api_uri': 'https://api.propublica.org/congress/v1/111/senate/committees/SSEV/subcommittees/SSEV10.json'}, {'id': 'SSEV08', 'name': 'Transportation and Infrastructure Subcommittee', 'api_uri': 'https://api.propublica.org/congress/v1/111/senate/committees/SSEV/subcommittees/SSEV08.json'}]",https://www.epw.senate.gov/public/
7,https://api.propublica.org/congress/v1/111/senate/committees/SSFI.json,Max Baucus,B000243,D,MT,https://api.propublica.org/congress/v1/members/B000243.json,Senate,SSFI,Committee on Finance,G000386,"[{'id': 'SSFI13', 'name': 'International Trade, Customs, and Global Competitiveness', 'api_uri': 'https://api.propublica.org/congress/v1/111/senate/committees/SSFI/subcommittees/SSFI13.json'}, {'id': 'SSFI12', 'name': 'Energy, Natural Resources, and Infrastructure Subcommittee', 'api_uri': 'https://api.propublica.org/congress/v1/111/senate/committees/SSFI/subcommittees/SSFI12.json'}, {'id': 'SSFI14', 'name': 'Subcommittee on Fiscal Responsibility and Economic Growth', 'api_uri': 'https://api.propublica.org/congress/v1/111/senate/committees/SSFI/subcommittees/SSFI14.json'}, {'id': 'SSFI10', 'name': 'Health Care Subcommittee', 'api_uri': 'https://api.propublica.org/congress/v1/111/senate/committees/SSFI/subcommittees/SSFI10.json'}, {'id': 'SSFI02', 'name': 'Social Security, Pensions, and Family Policy Subcommittee', 'api_uri': 'https://api.propublica.org/congress/v1/111/senate/committees/SSFI/subcommittees/SSFI02.json'}, {'id': 'SSFI11', 'name': 'Taxation and IRS Oversight Subcommittee', 'api_uri': 'https://api.propublica.org/congress/v1/111/senate/committees/SSFI/subcommittees/SSFI11.json'}]",https://www.finance.senate.gov/
8,https://api.propublica.org/congress/v1/111/senate/committees/SSFR.json,John Kerry,K000148,D,MA,https://api.propublica.org/congress/v1/members/K000148.json,Senate,SSFR,Committee on Foreign Relations,L000504,"[{'id': 'SSFR09', 'name': 'Africa and Global Health Policy Subcommittee', 'api_uri': 'https://api.propublica.org/congress/v1/111/senate/committees/SSFR/subcommittees/SSFR09.json'}, {'id': 'SSFR01', 'name': 'Europe and Regional Security Cooperation Subcommittee', 'api_uri': 'https://api.propublica.org/congress/v1/111/senate/committees/SSFR/subcommittees/SSFR01.json'}, {'id': 'SSFR02', 'name': 'East Asia, the Pacific, and International Cybersecurity Policy', 'api_uri': 'https://api.propublica.org/congress/v1/111/senate/committees/SSFR/subcommittees/SSFR02.json'}, {'id': 'SSFR07', 'name': 'Near East, South Asia, Central Asia, and Counterterrorism', 'api_uri': 'https://api.propublica.org/congress/v1/111/senate/committees/SSFR/subcommittees/SSFR07.json'}, {'id': 'SSFR06', 'name': ""Western Hemisphere, Transnational Crime, Civilian Security, Democracy, Human Rights, and Global Women's Issues"", 'api_uri': 'https://api.propublica.org/congress/v1/111/senate/committees/SSFR/subcommittees/SSFR06.json'}, {'id': 'SSFR14', 'name': 'State Department and USAID Management, International Operations, and Bilateral International Development', 'api_uri': 'https://api.propublica.org/congress/v1/111/senate/committees/SSFR/subcommittees/SSFR14.json'}, {'id': 'SSFR15', 'name': 'Multilateral International Development, Multilateral Institutions, and International Economic, Energy, and Environmental Policy', 'api_uri': 'https://api.propublica.org/congress/v1/111/senate/committees/SSFR/subcommittees/SSFR15.json'}]",https://www.foreign.senate.gov/
9,https://api.propublica.org/congress/v1/111/senate/committees/SSHR.json,Tom Harkin,H000206,D,IA,https://api.propublica.org/congress/v1/members/H000206.json,Senate,SSHR,"Committee on Health, Education, Labor, and Pensions",E000285,"[{'id': 'SSHR09', 'name': 'Children and Families Subcommittee', 'api_uri': 'https://api.propublica.org/congress/v1/111/senate/committees/SSHR/subcommittees/SSHR09.json'}, {'id': 'SSHR11', 'name': 'Employment and Workplace Safety Subcommittee', 'api_uri': 'https://api.propublica.org/congress/v1/111/senate/committees/SSHR/subcommittees/SSHR11.json'}, {'id': 'SSHR12', 'name': 'Primary Health and Retirement Security Subcommittee', 'api_uri': 'https://api.propublica.org/congress/v1/111/senate/committees/SSHR/subcommittees/SSHR12.json'}]",https://www.help.senate.gov/
10,https://api.propublica.org/congress/v1/111/senate/committees/SSGA.json,Joseph I. Lieberman,L000304,I,CT,https://api.propublica.org/congress/v1/members/L000304.json,Senate,SSGA,Committee on Homeland Security and Governmental Affairs,C001035,"[{'id': 'SSGA01', 'name': 'Investigations Subcommittee', 'api_uri': 'https://api.propublica.org/congress/v1/111/senate/committees/SSGA/subcommittees/SSGA01.json'}, {'id': 'SSGA19', 'name': 'Regulatory Affairs and Federal Management Subcommittee', 'api_uri': 'https://api.propublica.org/congress/v1/111/senate/committees/SSGA/subcommittees/SSGA19.json'}, {'id': 'SSGA18', 'name': 'Federal Spending Oversight and Emergency Management', 'api_uri': 'https://api.propublica.org/congress/v1/111/senate/committees/SSGA/subcommittees/SSGA18.json'}]",https://www.hsgac.senate.gov/
11,https://api.propublica.org/congress/v1/111/senate/committees/SLIA.json,Byron L. Dorgan,D000432,D,ND,https://api.propublica.org/congress/v1/members/D000432.json,Senate,SLIA,Committee on Indian Affairs,B001261,[],https://www.indian.senate.gov/
12,https://api.propublica.org/congress/v1/111/senate/committees/SSRA.json,Charles E. Schumer,S000148,D,NY,https://api.propublica.org/congress/v1/members/S000148.json,Senate,SSRA,Committee on Rules and Administration,B000382,[],https://www.rules.senate.gov/public/
13,https://api.propublica.org/congress/v1/111/senate/committees/SSSB.json,Mary L. Landrieu,L000550,D,LA,https://api.propublica.org/congress/v1/members/L000550.json,Senate,SSSB,Committee on Small Business and Entrepreneurship,S000663,[],https://www.sbc.senate.gov/public/
14,https://api.propublica.org/congress/v1/111/senate/committees/SSBU.json,Kent Conrad,C000705,D,ND,https://api.propublica.org/congress/v1/members/C000705.json,Senate,SSBU,Committee on the Budget,G000445,[],https://www.budget.senate.gov/
15,https://api.propublica.org/congress/v1/111/senate/committees/SSJU.json,Patrick J. Leahy,L000174,D,VT,https://api.propublica.org/congress/v1/members/L000174.json,Senate,SSJU,Committee on the Judiciary,H000338,"[{'id': 'SSJU01', 'name': 'Antitrust, Competition Policy and Consumer Rights Subcommittee', 'api_uri': 'https://api.propublica.org/congress/v1/111/senate/committees/SSJU/subcommittees/SSJU01.json'}, {'id': 'SSJU23', 'name': 'Privacy, Technology and the Law Subcommittee', 'api_uri': 'https://api.propublica.org/congress/v1/111/senate/committees/SSJU/subcommittees/SSJU23.json'}, {'id': 'SSJU04', 'name': 'Border Security and Immigration Subcommittee', 'api_uri': 'https://api.propublica.org/congress/v1/111/senate/committees/SSJU/subcommittees/SSJU04.json'}, {'id': 'SSJU22', 'name': 'Crime and Terrorism Subcommittee', 'api_uri': 'https://api.propublica.org/congress/v1/111/senate/committees/SSJU/subcommittees/SSJU22.json'}, {'id': 'SSJU21', 'name': 'Constitution Subcommittee', 'api_uri': 'https://api.propublica.org/congress/v1/111/senate/committees/SSJU/subcommittees/SSJU21.json'}, {'id': 'SSJU25', 'name': 'Oversight, Agency Action, Federal Rights and Federal Courts', 'api_uri': 'https://api.propublica.org/congress/v1/111/senate/committees/SSJU/subcommittees/SSJU25.json'}]",https://www.judiciary.senate.gov/
16,https://api.propublica.org/congress/v1/111/senate/committees/SSVA.json,Daniel K. Akaka,A000069,D,HI,https://api.propublica.org/congress/v1/members/A000069.json,Senate,SSVA,Committee on Veterans' Affairs,B001135,[],https://www.veterans.senate.gov/
17,https://api.propublica.org/congress/v1/111/senate/committees/SLET.json,Barbara Boxer,B000711,D,CA,https://api.propublica.org/congress/v1/members/B000711.json,Senate,SLET,Select Committee on Ethics,I000055,[],https://www.ethics.senate.gov/public/
18,https://api.propublica.org/congress/v1/111/senate/committees/SLIN.json,Dianne Feinstein,F000062,D,CA,https://api.propublica.org/congress/v1/members/F000062.json,Senate,SLIN,Select Committee on Intelligence,B000611,[],https://www.intelligence.senate.gov/
19,https://api.propublica.org/congress/v1/111/senate/committees/SPAG.json,Herb Kohl,K000305,D,WI,https://api.propublica.org/congress/v1/members/K000305.json,Senate,SPAG,Special Committee on Aging,C001071,[],https://www.aging.senate.gov/
